{
  "id": "reasignacion-ficticia-001",
  "conteoId": "conteo-ficticio-version-1",
  "jornadaId": "JORNADA-PRUEBA-ETAPA-3",
  "jornadaLineaId": "JORNADA-PRUEBA-ETAPA-3__LINEA-PRUEBA-1",
  "lineaId": "LINEA-PRUEBA-1",
  "autorOriginalUsuarioId": "uid-auxiliar-1",
  "responsableAnteriorUsuarioId": "uid-auxiliar-1",
  "nuevoUsuarioId": "uid-auxiliar-2",
  "actorUsuarioId": "uid-supervisor",
  "motivo": "El autor original no está disponible.",
  "motivoDevolucion": "Recontar la línea completa.",
  "reasignadaEn": "2026-07-15T14:00:00.000Z",
  "versionLinea": 4,
  "inmutable": true
}
